TITLE,LINK,AUTHOR
"NewCarney unveils billions in funding, Buy Canada policy to combat Trump's tariffs",https://www.cbc.ca/lite/story/1.7626064,N/A
NewCanada delaying plan to force automakers to hit sales targets for EVs next year: sources,https://www.cbc.ca/lite/story/1.7625992,N/A
What on EarthWhy are there so few affordable EVs in Canada?,https://www.cbc.ca/lite/story/1.7624821,N/A
Liberal MPs form environmental caucus as some want stronger climate focus from Carney,https://www.cbc.ca/lite/story/1.7625657,N/A
AnalysisCan the ZEV mandate survive political pressure and industry objections?,https://www.cbc.ca/lite/story/1.7610221,N/A
"Canadian economy bled 66,000 jobs in August as unemployment rate at its highest since 'pandemic days'",https://www.cbc.ca/lite/story/1.7625918,N/A
NewU.S. labour market weakens with little job growth and rising unemployment,https://www.cbc.ca/lite/story/1.7626074,N/A
GM Oshawa supplier to lay off nearly 250 workers this month as shift cut looms,https://www.cbc.ca/lite/story/1.7624398,N/A
Gen Z is facing the worst youth unemployment rate in decades. Here is how it's different,https://www.cbc.ca/lite/story/1.7549979,N/A
2 Canadians confirmed dead in Portugal funicular crash,https://www.cbc.ca/lite/story/1.7625893,N/A
Here are the facts on the Lisbon funicular that crashed,https://www.cbc.ca/lite/story/1.7625124,N/A
2 families rejected at Canadian border are now mired in what lawyer calls a 'black hole' of ICE detention,https://www.cbc.ca/lite/story/1.7625362,N/A
"NewDabrowski in final, Auger-Aliassime vs. Sinner on big day for Canada at U.S. Open",https://www.cbc.ca/lite/story/1.7625906,N/A
Is remote work gone for good? More Canadians are commuting — whether they want to or not,https://www.cbc.ca/lite/story/1.7619112,N/A
Florida is ending vaccine mandates. What do Canadian travellers need to know?,https://www.cbc.ca/lite/story/1.7625612,N/A
RFK Jr. grilled by both Republicans and Democrats during raucous hearing,https://www.cbc.ca/lite/story/1.7625329,N/A
'Reckless and dangerous': Florida to eliminate childhood vaccine mandates in schools,https://www.cbc.ca/lite/story/1.7624370,N/A
Old Dutch potato chips recalled due to allergen issue,https://www.cbc.ca/lite/story/1.7625994,N/A
N.S. has handed out over $1M in fire ban tickets. How much has actually been collected?,https://www.cbc.ca/lite/story/1.7619904,N/A
Lawyer says Jan. 6 rioters deserve compensation,https://www.cbc.ca/lite/story/1.7622967,N/A
Chinese-backed hackers 'almost certainly' targeted Canada during theft of millions of Americans' data,https://www.cbc.ca/lite/story/1.7625122,N/A
Xi Jinping  — flanked by Putin and Kim  — speaks of choice between war and peace at huge parade,https://www.cbc.ca/lite/story/1.7623751,N/A
'Frustrated' Caitlin Clark to miss rest of WNBA season because of injury,https://www.cbc.ca/lite/story/1.7626038,N/A
"Woman killed by brother in mass stabbing on Manitoba First Nation, RCMP say",https://www.cbc.ca/lite/story/1.7624882,N/A
"Lululemon says U.S. tariffs taking a bite, but also some of its athleisure wear became 'too predictable'",https://www.cbc.ca/lite/story/1.7625890,N/A
Canadian novelist Miriam Toews has suffered tremendous loss. Now she's telling her story,https://www.cbc.ca/lite/story/1.7624237,N/A
'Hope is diminishing for this year': P.E.I. potato farmers brace for crop losses due to lack of rain,https://www.cbc.ca/lite/story/1.7625184,N/A
Israeli reservists are risking jail time rather than serve in Gaza again,https://www.cbc.ca/lite/story/1.7625466,N/A
